"subcat","short_name","name","unit","unit_conv"
-4,"######################################################################################################","#","#","#"
-3,"DO NOT MODIFY THIS FILE. It is generated by frmts/grib/degrib/merge_degrib_and_wmo_tables.py","#","#","#"
-2,"from tables at version https://github.com/wmo-im/GRIB2/commit/a3711da874bc936639c4e4f26fa91c4b02659e61","#","#","#"
-1,"######################################################################################################","#","#","#"
0,"","Probability of encountering marginal visual flight rule conditions","%","UC_NONE"
1,"","Probability of encountering low instrument flight rule conditions","%","UC_NONE"
2,"","Probability of encountering instrument flight rule conditions","%","UC_NONE"
